{
  "report_format_version": "1.0",
  "report_type": "aicp.pairwise_joint_execution",
  "pairwise_tck_release": {
    "release_id": "AICP-PAIRWISE-TCK-1.0.0",
    "registry_digest": "sha256:4d8ca895e8848f4171b2c48952840d0e383a6cd1e43d966a6bd9582051d2182a",
    "runner_bundle_digest": "sha256:86eda6ccb0e7dac0d9ee7eb5a9c668a1a722a7656d08c0c3b4f31606dc7a1781",
    "report_schema_digest": "sha256:bccfe9710747ab8703ef262c0b86f452c36a65bfee26202a4d220adea202cdf9",
    "evaluator_digest": "sha256:fb8ca05a000f3ee372039d208436a0bdf9e79feb2c029f0ce7ac40eaeceec43b",
    "normalizer_digest": "sha256:b6f36f883dc71722a6b9b6833d59f76e527bc9ff96bc71a2175fe4e2fe261edf"
  },
  "target": {
    "profile_id": "AICP-BASE",
    "profile_version": "0.1",
    "binding_id": "BIND-MCP",
    "binding_version": "0.1",
    "target_catalog_digest": "sha256:4d638cbf22e206f2f39c4f252797dbfeead6b99de8f33938551b58698f33c8f4"
  },
  "scenario": {
    "scenario_id": "PAIRWISE-MCP-CROSS-CONSUMPTION-01",
    "scenario_catalog_digest": "sha256:baa3530ad3d277da265ebd0b5156e4da65590ad0dcc5794c37f59bc8a86ab46c",
    "scenario_schema_digest": "sha256:7c18b40e0a16d66015c2057d54777e0deecc4a7326d260a9f78248d4d77efe38"
  },
  "participants": [
    {
      "side": "A",
      "implementation_kind": "external_implementation",
      "implementation_id": "aicp-cleanroom-python-a",
      "implementation_version": "1.0.0-test",
      "implementation_digest": "sha256:9db54a0fcd97439d39ed7037523323efcfd0ccc8df97f5a0eb86affe5870b59c",
      "profile_report": {
        "path": "a-profile.json",
        "content_digest": "sha256:7cc170b17c63265190f4f35614017779218db52fbfe6d63d1279be6a3d72c00c"
      },
      "binding_report": {
        "path": "a-binding.json",
        "content_digest": "sha256:51510ba72bbffe85ddaeb569323be800457746ad93f54efd512dafe0c7f2d26c"
      },
      "descriptor_evidence": {
        "request": {
          "control_version": "aicp.pairwise_control.v1",
          "request_id": "run-1-343dc8473b5105bf5adaa8e3ce725b7c-A-describe",
          "operation": "describe"
        },
        "response": {
          "control_version": "aicp.pairwise_control.v1",
          "operation": "describe",
          "request_id": "run-1-343dc8473b5105bf5adaa8e3ce725b7c-A-describe",
          "result": {
            "implementation_digest": "sha256:9db54a0fcd97439d39ed7037523323efcfd0ccc8df97f5a0eb86affe5870b59c",
            "implementation_id": "aicp-cleanroom-python-a",
            "implementation_kind": "external_implementation",
            "implementation_version": "1.0.0-test",
            "supported_target": "AICP-BASE@0.1+BIND-MCP@0.1"
          },
          "success": true
        }
      }
    },
    {
      "side": "B",
      "implementation_kind": "external_implementation",
      "implementation_id": "aicp-cleanroom-node-b",
      "implementation_version": "1.0.0-test",
      "implementation_digest": "sha256:c4ecc4880a1cea9d865f664968300cca7062b1aab50ca84d80d8f56f44dfc00b",
      "profile_report": {
        "path": "b-profile.json",
        "content_digest": "sha256:e522df291ca0491ec62f6ffc4abc883adde7fa69c6d1542e14082f82eb5e9513"
      },
      "binding_report": {
        "path": "b-binding.json",
        "content_digest": "sha256:0a41f407ebc8d17000c28e3a63e203f8204d779a83a2aab2ff0121027f74389d"
      },
      "descriptor_evidence": {
        "request": {
          "control_version": "aicp.pairwise_control.v1",
          "request_id": "run-1-343dc8473b5105bf5adaa8e3ce725b7c-B-describe",
          "operation": "describe"
        },
        "response": {
          "control_version": "aicp.pairwise_control.v1",
          "operation": "describe",
          "request_id": "run-1-343dc8473b5105bf5adaa8e3ce725b7c-B-describe",
          "result": {
            "implementation_digest": "sha256:c4ecc4880a1cea9d865f664968300cca7062b1aab50ca84d80d8f56f44dfc00b",
            "implementation_id": "aicp-cleanroom-node-b",
            "implementation_kind": "external_implementation",
            "implementation_version": "1.0.0-test",
            "supported_target": "AICP-BASE@0.1+BIND-MCP@0.1"
          },
          "success": true
        }
      }
    }
  ],
  "side_evidence": [
    {
      "side": "A",
      "profile_report": {
        "path": "a-profile.json",
        "content_digest": "sha256:7cc170b17c63265190f4f35614017779218db52fbfe6d63d1279be6a3d72c00c"
      },
      "binding_report": {
        "path": "a-binding.json",
        "content_digest": "sha256:51510ba72bbffe85ddaeb569323be800457746ad93f54efd512dafe0c7f2d26c"
      }
    },
    {
      "side": "B",
      "profile_report": {
        "path": "b-profile.json",
        "content_digest": "sha256:e522df291ca0491ec62f6ffc4abc883adde7fa69c6d1542e14082f82eb5e9513"
      },
      "binding_report": {
        "path": "b-binding.json",
        "content_digest": "sha256:0a41f407ebc8d17000c28e3a63e203f8204d779a83a2aab2ff0121027f74389d"
      }
    }
  ],
  "runs": [
    {
      "run_id": "run-1-343dc8473b5105bf5adaa8e3ce725b7c",
      "challenge": "challenge-1-528f16586362da9c9dac4d06c047dcc4ad071d50faaf72732b47e786275664c5",
      "semantic_digest": "sha256:27e6986f2b3b3f306341bfab7cb848bf042a10e87641010c9c538d01a5e5de8e",
      "directions": [
        {
          "direction": "A_TO_B",
          "producer_side": "A",
          "consumer_side": "B",
          "session_id": "session-1-a_to_b-4dee41c2a192eccdaf2015637492b31d",
          "contract_id": "contract-1-a_to_b-8c228c38cb487b1f60851975cbfaccbc",
          "messages": [
            {
              "sequence": 1,
              "sender_side": "A",
              "constructed_by": "A",
              "consumed_by": "B",
              "message": {
                "contract_id": "contract-1-a_to_b-8c228c38cb487b1f60851975cbfaccbc",
                "contract_ref": {
                  "base_version": "v1",
                  "branch_id": "main",
                  "head_version": "v1"
                },
                "message_hash": "sha256:fG4E0p4LTjrkz1p_kQpXXGD77qfI5Ig3GrVFey49dIg",
                "message_id": "m-9549681e2e385f6b76f0ebc5",
                "message_type": "CONTRACT_PROPOSE",
                "payload": {
                  "contract": {
                    "contract_id": "contract-1-a_to_b-8c228c38cb487b1f60851975cbfaccbc",
                    "goal": "challenge-1-528f16586362da9c9dac4d06c047dcc4ad071d50faaf72732b47e786275664c5",
                    "roles": [
                      "initiator",
                      "responder"
                    ]
                  },
                  "contract_hash": "sha256:6bd6DMJWz2QPQKDzfbzMYs1IEkJz6-C5XsxekihplVs"
                },
                "sender": "aicp-cleanroom-python-a",
                "session_id": "session-1-a_to_b-4dee41c2a192eccdaf2015637492b31d",
                "timestamp": "2026-06-01T00:00:01Z"
              },
              "control_request": {
                "control_version": "aicp.pairwise_control.v1",
                "request_id": "run-1-343dc8473b5105bf5adaa8e3ce725b7c-A_TO_B-propose",
                "operation": "construct",
                "input": {
                  "phase": "propose",
                  "run_id": "run-1-343dc8473b5105bf5adaa8e3ce725b7c",
                  "side": "A",
                  "session_id": "session-1-a_to_b-4dee41c2a192eccdaf2015637492b31d",
                  "contract_id": "contract-1-a_to_b-8c228c38cb487b1f60851975cbfaccbc",
                  "message_id": "m-9549681e2e385f6b76f0ebc5",
                  "timestamp": "2026-06-01T00:00:01Z",
                  "challenge": "challenge-1-528f16586362da9c9dac4d06c047dcc4ad071d50faaf72732b47e786275664c5",
                  "visible_message_hashes": []
                }
              },
              "control_response": {
                "control_version": "aicp.pairwise_control.v1",
                "operation": "construct",
                "request_id": "run-1-343dc8473b5105bf5adaa8e3ce725b7c-A_TO_B-propose",
                "result": {
                  "message": {
                    "contract_id": "contract-1-a_to_b-8c228c38cb487b1f60851975cbfaccbc",
                    "contract_ref": {
                      "base_version": "v1",
                      "branch_id": "main",
                      "head_version": "v1"
                    },
                    "message_hash": "sha256:fG4E0p4LTjrkz1p_kQpXXGD77qfI5Ig3GrVFey49dIg",
                    "message_id": "m-9549681e2e385f6b76f0ebc5",
                    "message_type": "CONTRACT_PROPOSE",
                    "payload": {
                      "contract": {
                        "contract_id": "contract-1-a_to_b-8c228c38cb487b1f60851975cbfaccbc",
                        "goal": "challenge-1-528f16586362da9c9dac4d06c047dcc4ad071d50faaf72732b47e786275664c5",
                        "roles": [
                          "initiator",
                          "responder"
                        ]
                      },
                      "contract_hash": "sha256:6bd6DMJWz2QPQKDzfbzMYs1IEkJz6-C5XsxekihplVs"
                    },
                    "sender": "aicp-cleanroom-python-a",
                    "session_id": "session-1-a_to_b-4dee41c2a192eccdaf2015637492b31d",
                    "timestamp": "2026-06-01T00:00:01Z"
                  }
                },
                "success": true
              },
              "mcp_send": {
                "request": {
                  "jsonrpc": "2.0",
                  "id": "run-1-343dc8473b5105bf5adaa8e3ce725b7c-A_TO_B-1-send",
                  "method": "tools/call",
                  "params": {
                    "name": "aicp.sendMessage",
                    "arguments": {
                      "message": {
                        "contract_id": "contract-1-a_to_b-8c228c38cb487b1f60851975cbfaccbc",
                        "contract_ref": {
                          "base_version": "v1",
                          "branch_id": "main",
                          "head_version": "v1"